{
  "ad_proximity_risk": false,
  "anchor_index": 8,
  "anchor_selector": "h3",
  "anchor_text": "Proof of Income for Apartments",
  "insertion_mode": "after",
  "page_path": "/app/guides/page.tsx",
  "priority_level": 2,
  "risk_factors": [],
  "risk_score": 0,
  "slot_id": "47750cd50d67",
  "slot_key": "inline-8"
}