{
  "ad_proximity_risk": false,
  "anchor_index": 4,
  "anchor_selector": "h2",
  "anchor_text": "Scan Results",
  "insertion_mode": "after",
  "page_path": "/app/tools/lease-red-flag-scanner/page.tsx",
  "priority_level": 2,
  "risk_factors": [],
  "risk_score": 0,
  "slot_id": "1d02f4671552",
  "slot_key": "inline-4"
}