{
  "ad_proximity_risk": false,
  "anchor_index": 2,
  "anchor_selector": "h3",
  "anchor_text": "Average Savings",
  "insertion_mode": "after",
  "page_path": "/app/costs/page.tsx",
  "priority_level": 2,
  "risk_factors": [],
  "risk_score": 0,
  "slot_id": "92889289b566",
  "slot_key": "inline-2"
}