{
  "ad_proximity_risk": false,
  "anchor_index": 11,
  "anchor_selector": "h3",
  "anchor_text": "How to Save Money Renting",
  "insertion_mode": "after",
  "page_path": "/app/guides/page.tsx",
  "priority_level": 2,
  "risk_factors": [],
  "risk_score": 0,
  "slot_id": "a34f380aaced",
  "slot_key": "inline-11"
}