{
  "ad_proximity_risk": false,
  "anchor_index": 14,
  "anchor_selector": "h2",
  "anchor_text": "Diversity & Inclusion",
  "insertion_mode": "after",
  "page_path": "/app/editorial-policy/page.tsx",
  "priority_level": 2,
  "risk_factors": [],
  "risk_score": 0,
  "slot_id": "8dbd2fc02c7c",
  "slot_key": "inline-14"
}