{
  "ad_proximity_risk": false,
  "anchor_index": 10,
  "anchor_selector": "h3",
  "anchor_text": "Step 3: Correction & Disclosure",
  "insertion_mode": "after",
  "page_path": "/app/corrections/page.tsx",
  "priority_level": 2,
  "risk_factors": [],
  "risk_score": 0,
  "slot_id": "222be781085a",
  "slot_key": "inline-10"
}