{
  "ad_proximity_risk": false,
  "anchor_index": 1,
  "anchor_selector": "h3",
  "anchor_text": "{resource.title}",
  "insertion_mode": "after",
  "page_path": "/app/resources/page.tsx",
  "priority_level": 2,
  "risk_factors": [],
  "risk_score": 0,
  "slot_id": "65cb65dbfd5d",
  "slot_key": "inline-1"
}