{
  "ad_proximity_risk": false,
  "anchor_index": 4,
  "anchor_selector": "h3",
  "anchor_text": "Expert Tips",
  "insertion_mode": "after",
  "page_path": "/app/tools/rent-budget-checker/page.tsx",
  "priority_level": 2,
  "risk_factors": [],
  "risk_score": 0,
  "slot_id": "1b75e7da84af",
  "slot_key": "inline-4"
}