{
  "ad_proximity_risk": false,
  "anchor_index": 1,
  "anchor_selector": "h2",
  "anchor_text": "Base Information",
  "insertion_mode": "after",
  "page_path": "/app/tools/hidden-fees-estimator/page.tsx",
  "priority_level": 2,
  "risk_factors": [],
  "risk_score": 0,
  "slot_id": "8ffeffd88401",
  "slot_key": "inline-1"
}