{
  "ad_proximity_risk": false,
  "anchor_index": 2,
  "anchor_selector": "h2",
  "anchor_text": "Why Tenant Rights Vary by State",
  "insertion_mode": "after",
  "page_path": "/app/laws/page.tsx",
  "priority_level": 2,
  "risk_factors": [],
  "risk_score": 0,
  "slot_id": "c24c6ddc718f",
  "slot_key": "inline-2"
}