{
  "ad_proximity_risk": false,
  "anchor_index": 13,
  "anchor_selector": "h3",
  "anchor_text": "Best Apps for Renters",
  "insertion_mode": "after",
  "page_path": "/app/guides/page.tsx",
  "priority_level": 2,
  "risk_factors": [],
  "risk_score": 0,
  "slot_id": "221b53c87042",
  "slot_key": "inline-13"
}