{
  "ad_proximity_risk": false,
  "anchor_index": 13,
  "anchor_selector": "h2",
  "anchor_text": "What We Believe",
  "insertion_mode": "after",
  "page_path": "/app/about/page.tsx",
  "priority_level": 2,
  "risk_factors": [],
  "risk_score": 0,
  "slot_id": "b295a0da8dda",
  "slot_key": "inline-13"
}