{
  "ad_proximity_risk": false,
  "anchor_index": 5,
  "anchor_selector": "h3",
  "anchor_text": "How to Save Money Renting",
  "insertion_mode": "after",
  "page_path": "/app/costs/page.tsx",
  "priority_level": 2,
  "risk_factors": [],
  "risk_score": 0,
  "slot_id": "3c05ed113309",
  "slot_key": "inline-5"
}