{
  "ad_proximity_risk": false,
  "anchor_index": 2,
  "anchor_selector": "h3",
  "anchor_text": "Apartment Tour Checklist",
  "insertion_mode": "after",
  "page_path": "/app/guides/page.tsx",
  "priority_level": 2,
  "risk_factors": [],
  "risk_score": 0,
  "slot_id": "cab6c83b8677",
  "slot_key": "inline-2"
}