{
  "ad_proximity_risk": false,
  "anchor_index": 3,
  "anchor_selector": "h3",
  "anchor_text": "Email Us",
  "insertion_mode": "after",
  "page_path": "/app/corrections/page.tsx",
  "priority_level": 2,
  "risk_factors": [],
  "risk_score": 0,
  "slot_id": "b12577f6c6f6",
  "slot_key": "inline-3"
}