{
  "ad_proximity_risk": false,
  "anchor_index": 2,
  "anchor_selector": "h2",
  "anchor_text": "Why Renters Use These Tools",
  "insertion_mode": "after",
  "page_path": "/app/tools/page.tsx",
  "priority_level": 2,
  "risk_factors": [],
  "risk_score": 0,
  "slot_id": "4caa2a99b363",
  "slot_key": "inline-2"
}