{
  "ad_proximity_risk": false,
  "anchor_index": 1,
  "anchor_selector": "h2",
  "anchor_text": "How We Make Money",
  "insertion_mode": "after",
  "page_path": "/app/disclosure/page.tsx",
  "priority_level": 2,
  "risk_factors": [],
  "risk_score": 0,
  "slot_id": "880c6988ec04",
  "slot_key": "inline-1"
}